id,title,slug,slug,description,destination_id,duration_days,category,days,created_by,created_at,updated_at,is_published,view_count,use_count,like_count,featured,cover_image_url,groupsize,tags,template_type,source_trip_id,version,copied_count,last_copied_at,metadata
93d94f2f-030e-4d31-bc30-ab778655354a,Bangkok Explorer,bangkok-explorer,bangkok-explorer,"Temples, markets, and street food in the vibrant Thai capital",7add4d3c-71e9-4c79-b884-b1348e02b5bc,4,city,"[{""day"": 1, ""title"": ""Historic Bangkok"", ""activities"": [{""time"": ""09:00"", ""title"": ""Grand Palace & Wat Phra Kaew"", ""location"": ""Na Phra Lan Road, Bangkok"", ""description"": ""Visit the former royal residence and Temple of the Emerald Buddha""}, {""time"": ""12:30"", ""title"": ""Lunch at Tha Tien Market"", ""location"": ""Tha Tien Market, Bangkok"", ""description"": ""Try authentic Thai street food near the river""}, {""time"": ""14:00"", ""title"": ""Wat Pho"", ""location"": ""2 Sanamchai Road, Bangkok"", ""description"": ""See the famous Reclining Buddha and get a traditional Thai massage""}, {""time"": ""17:00"", ""title"": ""Chao Phraya River Cruise"", ""location"": ""Chao Phraya River, Bangkok"", ""description"": ""Evening boat ride with dinner along Bangkok's main river""}]}, {""day"": 3, ""title"": ""Local Life"", ""activities"": [{""time"": ""09:00"", ""title"": ""Chatuchak Weekend Market"", ""location"": ""Chatuchak Park, Bangkok"", ""description"": ""Explore one of the world's largest weekend markets""}, {""time"": ""13:00"", ""title"": ""Lunch at Or Tor Kor Market"", ""location"": ""Or Tor Kor Market, Bangkok"", ""description"": ""Premium fresh market with excellent food stalls""}, {""time"": ""15:00"", ""title"": ""Lumpini Park"", ""location"": ""Lumpini Park, Bangkok"", ""description"": ""Relax in Bangkok's central park and watch monitor lizards""}, {""time"": ""18:00"", ""title"": ""Dinner at Chinatown (Yaowarat)"", ""location"": ""Yaowarat Road, Bangkok"", ""description"": ""Experience the bustling food scene of Bangkok's Chinatown""}]}, {""day"": 4, ""title"": ""Cultural Immersion"", ""activities"": [{""time"": ""09:00"", ""title"": ""Thai Cooking Class"", ""location"": ""Silom Thai Cooking School, Bangkok"", ""description"": ""Learn to make authentic Thai dishes""}, {""time"": ""13:00"", ""title"": ""Lunch at your cooking class"", ""location"": ""Silom Thai Cooking School, Bangkok"", ""description"": ""Enjoy the fruits of your labor""}, {""time"": ""15:00"", ""title"": ""Bangkok Art and Culture Centre"", ""location"": ""939 Rama I Road, Bangkok"", ""description"": ""Explore contemporary Thai art and exhibitions""}, {""time"": ""19:00"", ""title"": ""Farewell dinner at Thipsamai"", ""location"": ""313-315 Maha Chai Road, Bangkok"", ""description"": ""Try the famous Pad Thai at this legendary restaurant""}]}]",b9cb6b57-c189-468a-a544-c31bf40f98d1,2025-04-22 14:24:34.087756+00,2025-04-22 14:24:34.087756+00,true,0,0,0,false,/bustling-bangkok-street.png,,,,,1,0,,{}
9fa63481-6b84-49f9-9da6-0d5ee4802fb7,California Road Trip,california-road-trip,california-road-trip,The ultimate coastal drive from San Francisco to Los Angeles,2086d8b7-ffbe-405f-9169-68ad21868318,7,road-trip,"[{""day"": 1, ""title"": ""San Francisco"", ""activities"": [{""time"": ""09:00"", ""title"": ""Golden Gate Bridge"", ""location"": ""Golden Gate Bridge, San Francisco"", ""description"": ""Walk or bike across this iconic landmark""}, {""time"": ""12:00"", ""title"": ""Lunch at Fisherman's Wharf"", ""location"": ""Fisherman's Wharf, San Francisco"", ""description"": ""Enjoy seafood with views of the bay""}]}]",b9cb6b57-c189-468a-a544-c31bf40f98d1,2025-04-22 14:24:34.087756+00,2025-04-22 14:24:34.087756+00,true,0,0,0,false,/california-highway-one.png,,,,,1,0,,{}
aa54d619-1a9b-4c02-ba7b-45d587fa21cf,Tokyo Adventure,tokyo-adventure,tokyo-adventure,"Explore the best of Tokyo in 5 days, from traditional temples to futuristic districts",d82ae2e1-012e-4a2d-aba6-a113d58c2f2d,5,city,"[{""day"": 1, ""title"": ""Traditional Tokyo"", ""activities"": [{""time"": ""09:00"", ""title"": ""Meiji Shrine"", ""location"": ""1-1 Yoyogikamizonocho, Shibuya City"", ""description"": ""Start with a peaceful visit to this beautiful Shinto shrine""}, {""time"": ""12:00"", ""title"": ""Lunch at Tsukiji Outer Market"", ""location"": ""Tsukiji, Chuo City"", ""description"": ""Enjoy fresh seafood at the famous market area""}, {""time"": ""14:00"", ""title"": ""Asakusa & Senso-ji Temple"", ""location"": ""2 Chome-3-1 Asakusa, Taito City"", ""description"": ""Visit Tokyo's oldest temple and shop on Nakamise Street""}, {""time"": ""18:00"", ""title"": ""Dinner in Asakusa"", ""location"": ""Asakusa area"", ""description"": ""Try traditional Japanese cuisine in a local restaurant""}]}, {""day"": 2, ""title"": ""Modern Tokyo"", ""activities"": [{""time"": ""10:00"", ""title"": ""Shibuya Crossing & Hachiko Statue"", ""location"": ""Shibuya, Tokyo"", ""description"": ""Experience the world's busiest pedestrian crossing""}, {""time"": ""13:00"", ""title"": ""Lunch at Shibuya Stream"", ""location"": ""3 Chome-21-3 Shibuya, Shibuya City"", ""description"": ""Modern dining in this new development""}, {""time"": ""15:00"", ""title"": ""Harajuku & Takeshita Street"", ""location"": ""Takeshita Street, Harajuku"", ""description"": ""Explore Japan's youth fashion center""}, {""time"": ""19:00"", ""title"": ""Dinner in Shinjuku"", ""location"": ""Shinjuku, Tokyo"", ""description"": ""Experience izakaya dining in this vibrant district""}]}]",b9cb6b57-c189-468a-a544-c31bf40f98d1,2025-04-22 14:24:34.087756+00,2025-04-22 14:24:34.087756+00,true,0,0,0,false,/tokyo-twilight.png,,,,,1,0,,{}
bfa9777a-c1d5-40b2-9387-fc88ba12bc99,Weekend in Paris,weekend-in-paris,weekend-in-paris,A perfect 3-day itinerary for first-time visitors to the City of Light,8204a5f2-2a2c-4bfd-bc33-d9428c349770,3,city,"[{""day"": 1, ""title"": ""Iconic Paris"", ""activities"": [{""time"": ""09:00"", ""title"": ""Eiffel Tower"", ""location"": ""Champ de Mars, 5 Avenue Anatole France"", ""description"": ""Start your day with stunning views from Paris's most iconic landmark""}, {""time"": ""12:30"", ""title"": ""Lunch at Café de Flore"", ""location"": ""172 Boulevard Saint-Germain"", ""description"": ""Enjoy a classic Parisian lunch at this historic café""}, {""time"": ""14:30"", ""title"": ""Louvre Museum"", ""location"": ""Rue de Rivoli"", ""description"": ""Explore one of the world's greatest art museums""}, {""time"": ""19:00"", ""title"": ""Seine River Cruise"", ""location"": ""Pont de l'Alma"", ""description"": ""See Paris illuminated from the water on an evening cruise""}]}, {""day"": 2, ""title"": ""Artistic Paris"", ""activities"": [{""time"": ""10:00"", ""title"": ""Montmartre & Sacré-Cœur"", ""location"": ""35 Rue du Chevalier de la Barre"", ""description"": ""Explore the artistic neighborhood and visit the beautiful basilica""}, {""time"": ""13:00"", ""title"": ""Lunch at Le Consulat"", ""location"": ""18 Rue Norvins"", ""description"": ""Dine at this quintessential Montmartre restaurant""}, {""time"": ""15:00"", ""title"": ""Musée d'Orsay"", ""location"": ""1 Rue de la Légion d'Honneur"", ""description"": ""Visit the impressive Impressionist collection in this former train station""}, {""time"": ""20:00"", ""title"": ""Dinner in Le Marais"", ""location"": ""Le Marais district"", ""description"": ""Enjoy dinner in one of Paris's trendiest neighborhoods""}]}, {""day"": 3, ""title"": ""Royal Paris"", ""activities"": [{""time"": ""09:30"", ""title"": ""Palace of Versailles"", ""location"": ""Place d'Armes, Versailles"", ""description"": ""Take a day trip to the magnificent royal palace""}, {""time"": ""16:00"", ""title"": ""Champs-Élysées & Arc de Triomphe"", ""location"": ""Champs-Élysées"", ""description"": ""Stroll down Paris's most famous avenue""}, {""time"": ""19:30"", ""title"": ""Farewell dinner at Le Petit Prince"", ""location"": ""12 Rue de Lanneau"", ""description"": ""Enjoy your last evening with classic French cuisine""}]}]",b9cb6b57-c189-468a-a544-c31bf40f98d1,2025-04-22 14:24:34.087756+00,2025-04-22 14:24:34.087756+00,true,0,0,0,false,/Parisian-Cafe-Scene.png,,,,,1,0,,{}
ffaf208d-bce4-46dc-ab7e-47dda3d8db50,Barcelona Weekend,barcelona-weekend,barcelona-weekend,"Beach, tapas, and architecture in this perfect weekend getaway",f98e1f67-2755-46fa-ab1b-5cb709e2fa05,3,beach,"[{""day"": 1, ""title"": ""Gaudí's Barcelona"", ""activities"": [{""time"": ""09:00"", ""title"": ""Sagrada Familia"", ""location"": ""Carrer de Mallorca, 401"", ""description"": ""Marvel at Gaudí's unfinished masterpiece""}, {""time"": ""12:30"", ""title"": ""Lunch at El Nacional"", ""location"": ""Passeig de Gràcia, 24 Bis"", ""description"": ""Multi-space culinary experience in a historic building""}, {""time"": ""14:30"", ""title"": ""Park Güell"", ""location"": ""Carrer d'Olot, 5"", ""description"": ""Explore this colorful park with amazing city views""}, {""time"": ""19:00"", ""title"": ""Tapas dinner in El Born"", ""location"": ""El Born district"", ""description"": ""Sample Spanish tapas in this trendy neighborhood""}]}]",b9cb6b57-c189-468a-a544-c31bf40f98d1,2025-04-22 14:24:34.087756+00,2025-04-22 14:24:34.087756+00,true,0,0,0,false,/barceloneta-sand-and-sea.png,,,,,1,0,,{}